{
  "$schema": "https://json-schema.org/draft/2020-12/schema",
  "title": "agent_harness_config_v1",
  "type": "object",
  "additionalProperties": false,
  "required": [
    "schema_version",
    "artifact_dir",
    "product_paths",
    "required_scripts",
    "doctor_profile",
    "command_policy"
  ],
  "properties": {
    "schema_version": {
      "const": "agent_harness_config_v1"
    },
    "artifact_dir": {
      "type": "string",
      "minLength": 1
    },
    "product_paths": {
      "type": "array",
      "items": {
        "type": "string",
        "minLength": 1
      }
    },
    "required_scripts": {
      "type": "array",
      "items": {
        "type": "string",
        "minLength": 1
      }
    },
    "doctor_profile": {
      "enum": [
        "generic",
        "stetix",
        "strict",
        "ci"
      ]
    },
    "command_policy": {
      "type": "object",
      "additionalProperties": false,
      "properties": {
        "allow": {
          "type": "array",
          "items": {
            "type": "string"
          }
        },
        "deny": {
          "type": "array",
          "items": {
            "type": "string"
          }
        },
        "strict_requires_allowed_command": {
          "type": "boolean"
        },
        "strict_disallow_shell": {
          "type": "boolean"
        }
      }
    },
    "runtime_capabilities": {
      "type": "object",
      "additionalProperties": false,
      "properties": {
        "runtime_name": {
          "type": "string"
        },
        "instruction_files": {
          "type": "array",
          "items": {
            "type": "string",
            "minLength": 1
          }
        },
        "supports_subagents": {
          "type": "boolean"
        },
        "supports_worktrees": {
          "type": "boolean"
        },
        "supports_json_output": {
          "type": "boolean"
        },
        "shell_permission_model": {
          "enum": [
            "ask",
            "allow",
            "deny",
            "unknown"
          ]
        },
        "preferred_output_format": {
          "enum": [
            "ultra_compact",
            "compact",
            "standard",
            "full"
          ]
        },
        "max_parallel": {
          "type": "integer",
          "minimum": 1
        }
      }
    },
    "token_budget": {
      "type": "object",
      "additionalProperties": false,
      "properties": {
        "observation_format": {
          "enum": [
            "ultra_compact",
            "compact",
            "standard",
            "full"
          ]
        },
        "summary_max_chars": {
          "type": "number",
          "exclusiveMinimum": 0
        },
        "output_excerpt_max_chars": {
          "type": "number",
          "exclusiveMinimum": 0
        },
        "report_compact_max_chars": {
          "type": "number",
          "exclusiveMinimum": 0
        }
      }
    },
    "codebase_memory": {
      "type": "object",
      "additionalProperties": false,
      "required": [
        "enabled",
        "memory_dir",
        "default_strategy",
        "stale_after_days",
        "max_summary_chars",
        "surface_budgets",
        "high_risk_surfaces"
      ],
      "properties": {
        "enabled": {
          "type": "boolean"
        },
        "memory_dir": {
          "type": "string",
          "minLength": 1
        },
        "default_strategy": {
          "enum": [
            "off",
            "query",
            "refresh"
          ]
        },
        "stale_after_days": {
          "type": "number",
          "exclusiveMinimum": 0
        },
        "max_summary_chars": {
          "type": "number",
          "exclusiveMinimum": 0
        },
        "surface_budgets": {
          "type": "object",
          "additionalProperties": {
            "type": "number",
            "exclusiveMinimum": 0
          }
        },
        "high_risk_surfaces": {
          "type": "array",
          "items": {
            "type": "string",
            "minLength": 1
          }
        }
      }
    },
    "learning_memory": {
      "type": "object",
      "additionalProperties": false,
      "required": [
        "enabled",
        "memory_dir",
        "top_k",
        "ttl_days",
        "max_summary_chars",
        "max_lessons_per_surface",
        "audit_cooldown_days",
        "audit_max_lessons",
        "audit_max_stale_ratio",
        "audit_max_low_confidence_ratio",
        "audit_max_duplicate_candidates",
        "audit_compact_max_chars"
      ],
      "properties": {
        "enabled": {
          "type": "boolean"
        },
        "memory_dir": {
          "type": "string",
          "minLength": 1
        },
        "top_k": {
          "type": "number",
          "exclusiveMinimum": 0
        },
        "ttl_days": {
          "type": "number",
          "exclusiveMinimum": 0
        },
        "max_summary_chars": {
          "type": "number",
          "exclusiveMinimum": 0
        },
        "max_lessons_per_surface": {
          "type": "number",
          "exclusiveMinimum": 0
        },
        "audit_cooldown_days": {
          "type": "number",
          "exclusiveMinimum": 0
        },
        "audit_max_lessons": {
          "type": "number",
          "exclusiveMinimum": 0
        },
        "audit_max_stale_ratio": {
          "type": "number",
          "exclusiveMinimum": 0
        },
        "audit_max_low_confidence_ratio": {
          "type": "number",
          "exclusiveMinimum": 0
        },
        "audit_max_duplicate_candidates": {
          "type": "number",
          "exclusiveMinimum": 0
        },
        "audit_compact_max_chars": {
          "type": "number",
          "exclusiveMinimum": 0
        }
      }
    },
    "weak_model": {
      "type": "object",
      "additionalProperties": false,
      "required": [
        "enabled",
        "max_files_per_task",
        "max_claims_per_action",
        "summary_max_chars",
        "output_excerpt_max_chars",
        "repair_hint_max_chars",
        "next_output_format"
      ],
      "properties": {
        "enabled": {
          "type": "boolean"
        },
        "max_files_per_task": {
          "type": "number",
          "exclusiveMinimum": 0
        },
        "max_claims_per_action": {
          "type": "number",
          "exclusiveMinimum": 0
        },
        "summary_max_chars": {
          "type": "number",
          "exclusiveMinimum": 0
        },
        "output_excerpt_max_chars": {
          "type": "number",
          "exclusiveMinimum": 0
        },
        "repair_hint_max_chars": {
          "type": "number",
          "exclusiveMinimum": 0
        },
        "next_output_format": {
          "enum": [
            "ultra_compact",
            "compact"
          ]
        }
      }
    },
    "scope_guard": {
      "type": "object",
      "additionalProperties": false,
      "required": [
        "enabled",
        "generated_allowlist"
      ],
      "properties": {
        "enabled": {
          "type": "boolean"
        },
        "generated_allowlist": {
          "type": "array",
          "items": {
            "type": "string",
            "minLength": 1
          }
        }
      }
    },
    "architecture_rules": {
      "type": "array",
      "items": {
        "type": "object",
        "additionalProperties": false,
        "required": [
          "id",
          "from",
          "forbid_import"
        ],
        "properties": {
          "id": {
            "type": "string",
            "pattern": "^[a-zA-Z0-9._-]+$"
          },
          "from": {
            "type": "string",
            "minLength": 1
          },
          "forbid_import": {
            "type": "string",
            "minLength": 1
          },
          "reason": {
            "type": "string",
            "minLength": 1
          }
        }
      }
    }
  }
}
